<?xml version="1.0" encoding="UTF-8"?>
<!--
  ~ jGuard is a security framework based on top of jaas (java authentication and authorization security).
  ~ it is written for web applications, to resolve simply, access control problems.
  ~ version $Name$
  ~ http://sourceforge.net/projects/jguard/
  ~
  ~ Copyright (C) 2004-2009  Charles GAY
  ~
  ~ This library is free software; you can redistribute it and/or
  ~ modify it under the terms of the GNU Lesser General Public
  ~ License as published by the Free Software Foundation; either
  ~ version 2.1 of the License, or (at your option) any later version.
  ~
  ~ This library is distributed in the hope that it will be useful,
  ~ but WITHOUT ANY WARRANTY; without even the implied warranty of
  ~ MERCHANTABILITY or FITNESS FOR A PARTICULAR PURPOSE.  See the GNU
  ~ Lesser General Public License for more details.
  ~
  ~ You should have received a copy of the GNU Lesser General Public
  ~ License along with this library; if not, write to the Free Software
  ~ Foundation, Inc., 59 Temple Place, Suite 330, Boston, MA  02111-1307  USA
  ~
  ~
  ~ jGuard project home page:
  ~ http://sourceforge.net/projects/jguard/
  -->

<callbackHandler xmlns="http://jguard.sourceforge.net/xsd/jGuardFilter_2.0.0.xsd"
                 xmlns:xs="http://www.w3.org/2001/XMLSchema-instance"
                 xs:schemaLocation="http://jguard.sourceforge.net/xsd/jGuardFilter_2.0.0.xsd jGuardFilter_2.0.0.xsd">
    <authenticationSchemeHandler
            className="net.sf.jguard.core.authentication.schemes.DummyAuthenticationSchemeHandler">
        <!-- Uri to access to the authentication form -->
        <parameter key="logonURI" value="/Logon.do"/>
        <!--  uri to be authenticated. The action property of the authentication form MUST NOT be set to j_security_check. -->
        <parameter key="logonProcessURI" value="/LogonProcess.do*"/>
        <!-- uri to to be unauthenticated -->
        <parameter key="logoffURI" value="/Logoff.do*"/>
        <parameter key="loginField" value="login"/>
        <!-- Parameter's name of the form's field which holds the password. All values are accepted except j_password. -->
        <parameter key="passwordField" value="password"/>
        <parameter key="goToLastAccessDeniedUriOnSuccess" value="true"/>
        <!-- Uri when the user authentication failed. -->
        <parameter key="authenticationFailedURI" value="/AuthenticationFailed.do*"/>
        <!-- Index uri of your web application. -->
        <parameter key="authenticationSucceedURI" value="/index.jsp"/>
        <!-- uri when access to a resource is denied -->
        <parameter key="accessDeniedURI" value="/AccessDenied.do*"/>
    </authenticationSchemeHandler>
</callbackHandler>
